{
  "$schema": "http://json-schema.org/draft-07/schema#",
  "$id": "https://frontend-lib.dev/ai/tokens.tree.schema.json",
  "title": "frontend-lib 第二种令牌导出（分层 · 工具链友好）",
  "$comment": [
    "描述 ai/tokens.tree.json 的形状：**分层、键名不带 --、字段用 value/type（不带 $）**。",
    "",
    "🔴 为什么要有第二种：已有的 ai/tokens.json 是 DTCG 形状（带 -- 与 $），",
    "   而 Style Dictionary 与 Figma Tokens（Tokens Studio）认的是**不带 $** 的",
    "   value/type，并且要按类别分层。同一个文件喂不进两套工具 ⇒ 两种各出一份，",
    "   index 段把两种键名互相对应起来。",
    "",
    "⚠️ 本文件是 05-audit/gen-tokens-tree.py 的**生成物**，不要手改。",
    "⚠️ 它的正确性不由本 schema 保证（形状对 ≠ 值对）：值与名字由",
    "   token-tree-gate.py 判据 ⑤ 挂到**浏览器 CSSOM** 上复核。",
    "⚠️ 本 schema 只用了 ai/validate.js 白名单里的关键字。"
  ],
  "type": "object",
  "required": ["schemaVersion", "source", "sets", "index", "meta"],
  "properties": {
    "schemaVersion": { "type": "string" },
    "source": { "type": "string" },
    "generatedBy": { "type": "string" },
    "$comment": { "type": "string" },
    "sets": {
      "type": "object",
      "additionalProperties": {
        "type": "object",
        "additionalProperties": {
          "type": "object",
          "additionalProperties": {
            "type": "object",
            "required": ["value", "type"],
            "properties": {
              "value": { "type": "string", "minLength": 1 },
              "type": { "type": "string", "minLength": 1 }
            }
          }
        }
      }
    },
    "index": {
      "type": "object",
      "additionalProperties": { "type": "string", "pattern": "^[a-z][A-Za-z0-9]*/" }
    },
    "meta": {
      "type": "object",
      "required": ["lightCount", "darkCount"],
      "properties": {
        "lightCount": { "type": "integer", "minimum": 0 },
        "darkCount": { "type": "integer", "minimum": 0 },
        "categories": { "type": "array", "items": { "type": "string" } }
      }
    }
  }
}
